username,video_title,profile_link,video_url
LordTorquemada, He is busy kissing a man and he don't even know it !!! He Finds Out though! ,https://theworldwatch.com/members/1318226/,https://theworldwatch.com/videos/1619622/they-are-busy-kissing-a-man-and-they-don-t-even-know-it/
Elliot87, He is busy kissing a man and he don't even know it !!! He Finds Out though! ,https://theworldwatch.com/members/1322420/,https://theworldwatch.com/videos/1619622/they-are-busy-kissing-a-man-and-they-don-t-even-know-it/
Mark_ey, He is busy kissing a man and he don't even know it !!! He Finds Out though! ,https://theworldwatch.com/members/1321844/,https://theworldwatch.com/videos/1619622/they-are-busy-kissing-a-man-and-they-don-t-even-know-it/
Naap51stang, He is busy kissing a man and he don't even know it !!! He Finds Out though! ,https://theworldwatch.com/members/1323703/,https://theworldwatch.com/videos/1619622/they-are-busy-kissing-a-man-and-they-don-t-even-know-it/
Dan, He is busy kissing a man and he don't even know it !!! He Finds Out though! ,https://theworldwatch.com/members/2/,https://theworldwatch.com/videos/1619622/they-are-busy-kissing-a-man-and-they-don-t-even-know-it/
KillerManJaro, Saying Goodbye to the Love of your Life.. ,https://theworldwatch.com/members/1324629/,https://theworldwatch.com/videos/1619617/saying-goodbye-to-the-love-of-your-life/
Jasondr91, Saying Goodbye to the Love of your Life.. ,https://theworldwatch.com/members/623283/,https://theworldwatch.com/videos/1619617/saying-goodbye-to-the-love-of-your-life/
BigJimsWornOutTireSale, Saying Goodbye to the Love of your Life.. ,https://theworldwatch.com/members/1323681/,https://theworldwatch.com/videos/1619617/saying-goodbye-to-the-love-of-your-life/
pokahounted, Saying Goodbye to the Love of your Life.. ,https://theworldwatch.com/members/1323713/,https://theworldwatch.com/videos/1619617/saying-goodbye-to-the-love-of-your-life/
Superb Nipple Man, You could Never Predict How this Guy is About to Die..(Slow Motion Added) ,https://theworldwatch.com/members/1324276/,https://theworldwatch.com/videos/1619618/you-could-never-predict-how-this-guy-is-about-to-die-slow-motion-added/
RumNbass89, You could Never Predict How this Guy is About to Die..(Slow Motion Added) ,https://theworldwatch.com/members/1322157/,https://theworldwatch.com/videos/1619618/you-could-never-predict-how-this-guy-is-about-to-die-slow-motion-added/
wmr2, lady in Uganda strips naked in the middle of the road for unclear reasons. ,https://theworldwatch.com/members/1319316/,https://theworldwatch.com/videos/1619621/lady-in-uganda-stripped-naked-in-the-middle-of-the-road-for-unclear-reasons/
WonkasWilly, lady in Uganda strips naked in the middle of the road for unclear reasons. ,https://theworldwatch.com/members/1323250/,https://theworldwatch.com/videos/1619621/lady-in-uganda-stripped-naked-in-the-middle-of-the-road-for-unclear-reasons/
